Data,Hora,Ano,Mês,Site,Manchete,Polaridade
24/02/2024,17:55:00,2024,fevereiro,Estadão MT,Mais de 340 mil pessoas já solicitaram nova Carteira de Identidade Nacional em MT,1
24/02/2024,19:20:00,2024,fevereiro,Só Notícias,Casal que morreu em acidente no Nortão é sepultado,1
24/02/2024,08h:48,2024,fevereiro,Folhamax,Mais de 340 mil pessoas já solicitaram nova Carteira de Identidade em MT,1
24/02/2024,08h:57,2024,fevereiro,Gazeta Digital,Mais de 340 mil pessoas já solicitaram nova Carteira de Identidade Nacional em MT,1
24/02/2024,18h:19,2024,fevereiro,Gazeta Digital,Colisão entre Pálio e Amarok deixa 1 morto em VG,1
24/02/2024,19h:55,2024,fevereiro,Folhamax,Casal de idosos morre em acidente envolvendo Hilux em MT,1
25/02/2024,15:22:00,2024,fevereiro,Reporter MT,Motociclista morre após acidente em rodovia,1
25/02/2024,16:47:00,2024,fevereiro,Reporter MT,Homem é morto a tiros em estacionamento de supermercado em MT,1
25/02/2024,20:20:00,2024,fevereiro,Só Notícias,Homem é encontrado morto às margens de rodovia em Sinop; suspeita de homicídio,1
26/02/2024,09:05:00,2024,fevereiro,Só Notícias,Corpo em estado de decomposição é localizado em rio em Nova Mutum,1
26/02/2024,09:19:00,2024,fevereiro,Reporter MT,Mulher faz chamada de vídeo com amigo e logo depois é encontrada morta em casa,1
26/02/2024,09:56:00,2024,fevereiro,Reporter MT,Ciclista é encontrado morto às margens de rodovia em MT,1
26/02/2024,10:46:00,2024,fevereiro,Reporter MT,Corpo de homem é encontrado boiando em rio,1
26/02/2024,10:49:00,2024,fevereiro,Só Notícias,Parte de corpo humano é encontrada em rio no Nortão,1
26/02/2024,11:10:00,2024,fevereiro,Só Notícias,Politec identifica jovem encontrado morto às margens de rodovia em Sinop,2
26/02/2024,15:14:00,2024,fevereiro,Reporter MT,Perna humana tatuada é encontrada boiando no Rio Arinos,1
26/02/2024,16:16:00,2024,fevereiro,Reporter MT,"Motociclista morre após ""atropelar"" corrente de proteção de empresa",1
26/02/2024,07h:31,2024,fevereiro,Gazeta Digital,Homem morre em acidente com moto em Lucas do Rio Verde; o garupa foi socorrido,1
26/02/2024,07h:45,2024,fevereiro,Folhamax,Ciclista é assassinado e deixado às margens de rodovia no Nortão de MT,1
26/02/2024,08h:17,2024,fevereiro,Gazeta Digital,Corpo de homem em decomposição é achado em rio de Nova Mutum,1
26/02/2024,09h:25,2024,fevereiro,Folhamax,Motociclista morre após sofrer acidente em avenida de MT; vídeo,1
26/02/2024,10h:07,2024,fevereiro,Folhamax,Agente da PRF morre aos 49 anos durante plantão em MT,1
26/02/2024,11h:04,2024,fevereiro,Folhamax,Corpo de homem é achado dentro de rio com orelha cortada em MT,1
26/02/2024,11h:44,2024,fevereiro,Gazeta Digital,"Perna tatuada é encontrada boiando no rio Arinos, em Itanhangá; polícia investiga",1
26/02/2024,14h:24,2024,fevereiro,Folhamax,Evento discute protocolo integrado para atender vítimas sexuais,1
26/02/2024,17h:45,2024,fevereiro,Gazeta Digital,Jovem morre em queda de moto ao passar por lombada,1
27/02/2024,08:23:00,2024,fevereiro,Só Notícias,Adolescente de 15 anos morre após colidir moto em árvore em Mato Grosso,1
27/02/2024,09:24:00,2024,fevereiro,Reporter MT,"Jovem perde controle de moto, bate em árvore e morre em MT",1
27/02/2024,14:15:00,2024,fevereiro,Só Notícias,Adolescente investigado por homicídio é apreendido em Nova Mutum,1
27/02/2024,15:28:00,2024,fevereiro,Midia News,Politec e MPE discutem criação de protocolo integrado de atuação,2
27/02/2024,16:10:00,2024,fevereiro,Reporter MT,Bebê de 1 ano tem parada cardiorrespiratória e morre em MT,1
27/02/2024,16:34:00,2024,fevereiro,Estadão MT,Adolescente é alvo de operação por morte de homem achado em rio,1
27/02/2024,17:46:00,2024,fevereiro,Midia News,Sedec e Politec assinam termo de adesão ao programa Integridade MT,2
27/02/2024,18:01:00,2024,fevereiro,Estadão MT,Justiça determina retorno de jovem que matou amiga à faculdade de onde foi expulsa,1
27/02/2024,18:55:00,2024,fevereiro,Só Notícias,Homem é executado a tiros dentro de caminhonete em Lucas do Rio Verde,1
27/02/2024,09h:42,2024,fevereiro,Folhamax,Pai tenta estancar sangue do filho baleado; rapaz morre na rua,1
27/02/2024,10h:36,2024,fevereiro,Gazeta Digital,Menor é apreendido e confessa ter matado jovem; corpo foi achado no rio,1
27/02/2024,13h:15,2024,fevereiro,Folhamax,Adolescente confessa homicídio de rapaz que sumiu ao deixar boate,1
27/02/2024,17h:00,2024,fevereiro,Folhamax,Justiça manda assassina da melhor amiga em MT voltar a faculdade em SP,1
28/02/2024,08:59:00,2024,fevereiro,Reporter MT,Bandidos em moto executam homem na porta de banco,1
28/02/2024,10:38:00,2024,fevereiro,Só Notícias,Mauro diz que MT tem investimento recorde na segurança ‘jogando duro’ contra criminalidade,1
28/02/2024,11:20:00,2024,fevereiro,Só Notícias,Corpo de homem é localizado às margens de rio em Sinop,1
28/02/2024,12:00:00,2024,fevereiro,Reporter MT,"Mauro destaca alto investimento na Segurança: ""Estamos jogando duro contra a bandidagem""",1
28/02/2024,14:45:00,2024,fevereiro,Reporter MT,Politec confirma que aluno dos Bombeiros morreu por afogamento em Cuiabá,2
28/02/2024,16:02:00,2024,fevereiro,Reporter MT,Homem morre durante banho com o filho no Rio Cuiabá,1
28/02/2024,16:13:00,2024,fevereiro,Reporter MT,"Em Goiás, familiares fazem cortejo de aluno dos Bombeiros que morreu afogado em Cuiabá",1
28/02/2024,07h:15,2024,fevereiro,Gazeta Digital,Dupla mata homem com tiro na cabeça na porta de banco,1
28/02/2024,08h:20,2024,fevereiro,Gazeta Digital,Adolescente de 16 anos é assassinado em casa de Cáceres; tiro atingiu olho direito,1
28/02/2024,09h:12,2024,fevereiro,Folhamax,Criminoso invade casa e mata adolescente a tiros em cidade de MT,1
28/02/2024,10h:07,2024,fevereiro,Folhamax,Mauro destaca luta contra violência em MT,1
28/02/2024,14h:30,2024,fevereiro,Folhamax,Homem morre afogado durante banho no Rio Cuiabá,1
28/02/2024,15h:30,2024,fevereiro,Gazeta Digital,Homem morre afogado enquanto tomava banho com o filho no Rio Cuiabá,1
28/02/2024,15h:50,2024,fevereiro,Gazeta Digital,Soldado é enterrado com homenagens e IML acusa afogamento,2
28/02/2024,16h:11,2024,fevereiro,Folhamax,Polícia Civil incinera mais de 200 quilos de drogas em MT,1
28/02/2024,16h:32,2024,fevereiro,Folhamax,Laudo aponta que aluno morreu afogado durante curso dos Bombeiros,2
28/02/2024,18h:05,2024,fevereiro,Folhamax,Faculdade vai recorrer para manter expusão de assassina da amiga,1
28/02/2024,20h:56,2024,fevereiro,Folhamax,Soldado deixou engenharia para ser bombeiro: era um sonho,1
29/02/2024,07:39:00,2024,fevereiro,Estadão MT,Homem é executado e corpo abandonado às margens de rio com mãos amarradas,1
29/02/2024,07:39:00,2024,fevereiro,Só Notícias,Homem é assassinado a tiros próximo de rodoviária no Nortão,1
29/02/2024,08:15:00,2024,fevereiro,Só Notícias,Três morrem em colisão entre caminhonete e carro em Mato Grosso,1
29/02/2024,08:33:00,2024,fevereiro,Só Notícias,Homem é encontrado morto em residência em Sorriso,1
29/02/2024,09:06:00,2024,fevereiro,Reporter MT,Hilux bate de frente com Uno e deixa três mortos; motorista de caminhonete fugiu,1
29/02/2024,09:37:00,2024,fevereiro,Reporter MT,Dupla em moto executa homem em frente à rodoviária,1
29/02/2024,10:49:00,2024,fevereiro,Só Notícias,Motociclista que morreu em acidente em rodovia é sepultado em Alta Floresta,1
29/02/2024,12:01:00,2024,fevereiro,Reporter MT,Corpo de homem é encontrado com mãos e pés amarrados no Rio das Garças,1
29/02/2024,14:40:00,2024,fevereiro,Só Notícias,Pai e filho estão entre mortos de grave acidente entre caminhonete e carro no MT; motorista preso,1
29/02/2024,15:08:00,2024,fevereiro,Reporter MT,Jovem de 18 anos é atropelado por caminhão e morre na MT-070,1
29/02/2024,15:55:00,2024,fevereiro,Só Notícias,Homem morre afogado em pescaria no Mato Grosso,1
29/02/2024,17:30:00,2024,fevereiro,Reporter MT,"Homem perde controle de motocicleta, bate em meio-fio e morre",1
29/02/2024,18:08:00,2024,fevereiro,Reporter MT,Coronel dos Bombeiros é nomeado para conduzir inquérito que investiga morte de aluno em treinamento,1
29/02/2024,07h:27,2024,fevereiro,Gazeta Digital,Dupla mata homem com tiros na cabeça em rodoviária de MT,1
29/02/2024,07h:32,2024,fevereiro,Gazeta Digital,Homem de 59 anos morre após bater moto contra meio-fio,1
29/02/2024,07h:40,2024,fevereiro,Gazeta Digital,Corpo de homem é encontrado com mãos amarradas e lesões na cabeça no interior,1
29/02/2024,07h:48,2024,fevereiro,Folhamax,Piloto morre na hora ao bater moto contra meio-fio em MT,1
29/02/2024,09h:09,2024,fevereiro,Gazeta Digital,Exame de necrópsia aponta que bombeiro militar morreu de asfixia por afogamento,2
29/02/2024,09h:22,2024,fevereiro,Gazeta Digital,Acidente entre Uno e Hilux deixa 3 mortos e dois feridos em Canarana,1
29/02/2024,12h:15,2024,fevereiro,Folhamax,Saiba quem era o aluno que morreu durante curso dos bombeiros em MT,1
29/02/2024,15h:20,2024,fevereiro,Gazeta Digital,Motociclista morre atingido por caminhão e condutor foge,1
29/02/2024,15h:32,2024,fevereiro,Folhamax,Jovem morre em rodovia de MT ao ter moto atingida por caminhão,1
29/02/2024,19h:02,2024,fevereiro,Folhamax,Batida entre Hilux e Uno matou pai e filho em MT,1
01/03/2024,09:12:00,2024,março,Só Notícias,Bombeiros controlam princípio de incêndio em picape no Nortão; polícia investiga,1
01/03/2024,13:02:00,2024,março,Reporter MT,MP pede reconstituição da morte de aluno e dá 40 dias para Corpo de Bombeiros concluir investigação,1
01/03/2024,12h:55,2024,março,Folhamax,MP quer simulação sobre morte de soldado em curso dos Bombeiros,1
02/03/2024,08:55:00,2024,março,Só Notícias,Corpo de sargento da PM é encontrado em rio no Mato Grosso; soldado segue desaparecido,1
02/03/2024,14:01:00,2024,março,Só Notícias,Jovem morre em acidente com moto de alta cilindrada na BR-163 em Sorriso,1
02/03/2024,16:02:00,2024,março,Estadão MT,Motociclista morre em acidente com moto de alta cilindrada na BR-163,1
02/03/2024,07h:16,2024,março,Gazeta Digital,Vizinhos encontram homem morto dentro de lago em MT,1
02/03/2024,08h:02,2024,março,Gazeta Digital,Homem morre em casa e tem parte do rosto comido pelos cães; polícia investiga,1
02/03/2024,08h:33,2024,março,Folhamax,Batida entre caminhão e carreta deixa homem com rosto desfigurado; veja vídeos,1
02/03/2024,10h:23,2024,março,Folhamax,Peritos comemoram abertura de vagas e inclusão de nova profissão,1
02/03/2024,10h:30,2024,março,Folhamax,Homem morre em casa e tem partes do corpo comidas por cães em MT,1
02/03/2024,11h:10,2024,março,Folhamax,Empresário morre afogado após cair dentro de lago em MT,1
02/03/2024,14h:20,2024,março,Folhamax,Piloto morre ao bater moto de altas cilindradas contra carreta na BR-163,1
02/03/2024,17h:55,2024,março,Folhamax,Motorista morre ao bater de frente com carreta na Imigrantes,1
03/03/2024,08:54:00,2024,março,Só Notícias,Corpo é localizado às margens de lagoa no Nortão,1
03/03/2024,10:22:00,2024,março,Estadão MT,Homem é executado a tiros em frente a conveniência em MT,1
03/03/2024,11:36:00,2024,março,Só Notícias,Lei seca em Sinop tem 19 motoristas presos por embriaguez e 45 veículos apreendidos,1
03/03/2024,14:05:00,2024,março,Estadão MT,"Três meses depois, Polícia ainda tenta identificar homem que matou dois no Shopping Popular",1
03/03/2024,14:15:00,2024,março,Só Notícias,Caminhoneiro que morreu em acidente na BR-163 é sepultado em Sorriso,1
03/03/2024,15:51:00,2024,março,Estadão MT,Ciclista de 63 anos morre após ser atropelado em rodovia; carro capota,1
03/03/2024,18:51:00,2024,março,Só Notícias,"Motociclista cai, tem perna perfurada por ferro da garupa e morre no Nortão",1
03/03/2024,09h:47,2024,março,Folhamax,Politec reúne 100 servidores para reunião gerencial,2
03/03/2024,09h:48,2024,março,Gazeta Digital,Homem é executado a tiros em conveniência no interior de MT,1
03/03/2024,13h:30,2024,março,Folhamax,Ciclista morre atropelado por carro em ciclovia; veículo capota,1
03/03/2024,17h:15,2024,março,Folhamax,Ex-presidiário é executado em conveniência em cidade de MT,1
04/03/2024,07:39:00,2024,março,Só Notícias,Dois homens são mortos a tiros e um socorrido em Sinop,1
04/03/2024,07:59:00,2024,março,Estadão MT,Cabeça humana achada em mochila é de rapaz morto pelo CV,1
04/03/2024,09:07:00,2024,março,Estadão MT,Tio que estuprou os dois sobrinhos é procurado pela Polícia em MT,1
04/03/2024,09:14:00,2024,março,Reporter MT,"Idoso cai de moto, tem perna perfurada e morre em MT",1
04/03/2024,10:25:00,2024,março,Reporter MT,Cabeça de jovem sequestrado e executado é encontrada dentro de mochila infantil,1
04/03/2024,10:55:00,2024,março,Reporter MT,Homem é morto a tiros e amigo é baleado em MT,1
04/03/2024,11:11:00,2024,março,Reporter MT,Família de aluno soldado morto vem a Cuiabá,1
04/03/2024,14:54:00,2024,março,Só Notícias,"Suspeito de matar homem enquanto dormia é identificado em Sorriso, confirma delegado",1
04/03/2024,15:54:00,2024,março,Só Notícias,Polícia procura suspeito de estupro a sobrinhos em Peixoto de Azevedo,1
04/03/2024,18:59:00,2024,março,Reporter MT,Homem é morto com tiro na cabeça em plantação de milho,1
04/03/2024,19:29:00,2024,março,Reporter MT,Idoso é encontrado morto em ponto de ônibus no CPA 4,1
04/03/2024,21:35:00,2024,março,Só Notícias,Polícia prende suspeito de matar jovem no Médio Norte,1
04/03/2024,08h:00,2024,março,Gazeta Digital,Idoso morre após cair de moto em estrada de Claúdia,1
04/03/2024,08h:25,2024,março,Folhamax,Idoso cai de motocicleta  e morre na hora em cidade de MT,1
04/03/2024,09h:41,2024,março,Folhamax,Cabeça de jovem sequestrado por facção é encontrada em mochila,1
04/03/2024,13h:28,2024,março,Gazeta Digital,Homem de 46 anos é procurado por abusar sexualmente de sobrinhos,1
04/03/2024,14h:20,2024,março,Folhamax,Peão estupra sobrinhos em fazenda e está foragido em cidade de MT; veja fotos,1
04/03/2024,14h:29,2024,março,Folhamax,MP leva campanha contra violência até shopping de Cuiabá,1
04/03/2024,16h:17,2024,março,Gazeta Digital,Ciclista de 63 anos morre após ser atropelado em ciclovia na MT-343,1
04/03/2024,17h:32,2024,março,Folhamax,Homem é executado e tem corpo deixado em plantação de milho,1
04/03/2024,18h:53,2024,março,Folhamax,Workshop de sensibilização do Projeto Luz capacita 1.704 pessoas,1
04/03/2024,21h:47,2024,março,Folhamax,PC prende assassino que matou jovem e jogou corpo em lavoura em MT,1
05/03/2024,07:23:00,2024,março,Estadão MT,Corpos de jovens mortos pelo CV são encontrados próximo a carro carbonizado,1
05/03/2024,09:06:00,2024,março,Estadão MT,"Homem que atirou em rapaz, rasgou cabeça com faca e incendiou cadáver é preso",1
05/03/2024,10:23:00,2024,março,Só Notícias,Colisão entre carro e moto deixa um morto em rodovia no Nortão,1
05/03/2024,11:28:00,2024,março,Só Notícias,Motociclista morre após colisão com carro em rodovia federal de Mato Grosso,1
05/03/2024,11:38:00,2024,março,Reporter MT,Motociclista bate em carro e morre na BR-070,1
05/03/2024,13:25:00,2024,março,Reporter MT,Idoso é atropelado na MT-343 e morre,1
05/03/2024,16:54:00,2024,março,Estadão MT,Estrutura despenca e mata trabalhador de 40 anos em obra em VG,1
05/03/2024,09h:56,2024,março,Gazeta Digital,Campanha do MPMT ocupa ponto estratégico em shopping de Cuiabá,1
05/03/2024,11h:31,2024,março,Gazeta Digital,Homem morre em acidente entre moto e carro na BR-070,1
05/03/2024,17h:01,2024,março,Folhamax,Trabalhador morre atingido por estrutura de obra em VG,1
05/03/2024,18h:27,2024,março,Gazeta Digital,Empresário morre após laje de igreja desabar durante obra em VG,1
05/03/2024,22h:32,2024,março,Folhamax,Primeira-dama de MT lidera movimento social,1
06/03/2024,08:40:00,2024,março,Reporter MT,Laje de obra de igreja desaba e pedreiro morre esmagado em VG,1
06/03/2024,08:58:00,2024,março,Só Notícias,Psicóloga e irmão são assassinados a tiros no Médio Norte; corpos trasladados,1
06/03/2024,09:22:00,2024,março,Reporter MT,Bandidos invadem casa e matam psicóloga e irmão de 14 anos a tiros,1
06/03/2024,09:38:00,2024,março,Só Notícias,Empresário é encontrado morto com sinais de atropelamento em Colíder,1
06/03/2024,11:08:00,2024,março,Reporter MT,Laudo descarta acidente ou tentativa de suicídio e diz que PM foi assassinado,2
06/03/2024,11:26:00,2024,março,Reporter MT,"Caminhonete bate em pedra, empresário é arremessado e morre atropelado",1
06/03/2024,13:10:00,2024,março,Reporter MT,Empresário é encontrado morto dentro de casa; carro e celular foram roubados,1
06/03/2024,14:14:00,2024,março,Reporter MT,"""Se o treinamento continuar dessa forma, outros irão morrer"", alerta pai de Lucas Peres",1
06/03/2024,16:06:00,2024,março,Estadão MT,Operador de máquinas é executado a tiros em garimpo,1
06/03/2024,16:50:00,2024,março,Midia News,MT completa um ano do início da emissão da nova Carteira de Identidade,1
06/03/2024,17:21:00,2024,março,Estadão MT,Perícia descarta tiro acidental em morte de PM durante briga com a esposa,2
06/03/2024,20:11:00,2024,março,Só Notícias,Jovem é encontrado morto após ser sequestrado com a esposa em Sorriso,1
06/03/2024,08h:15,2024,março,Folhamax,Empresário morre ao ser lançado para fora de caminhonete em curva,1
06/03/2024,11h:49,2024,março,Gazeta Digital,Homem é encontrado em decomposição em casa no CPA,1
06/03/2024,12h:20,2024,março,Folhamax,Laudo descarta tiro acidental em morte de cabo da PM; esposa vira suspeita,2
06/03/2024,16h:28,2024,março,Folhamax,MT entrega 364 mil carteiras de identidade,1
06/03/2024,17h:30,2024,março,Gazeta Digital,Motorista morre ao ser atropelado pelo próprio caminhão em MT,1
07/03/2024,07:00:00,2024,março,Reporter MT,Corpo de Bombeiros faz mudança total de instrutores de Curso de Formação em MT,1
07/03/2024,08:22:00,2024,março,Só Notícias,Seis pessoas são assassinadas em menos de uma hora em município de Mato Grosso,1
07/03/2024,09:16:00,2024,março,Estadão MT,Rapaz sequestrado é encontrado morto com facada no coração em Sorriso,1
07/03/2024,09:16:00,2024,março,Reporter MT,Seis pessoas são assassinadas a tiros em noite de ataques em MT,1
07/03/2024,10:37:00,2024,março,Reporter MT,Homem é sequestrado e morto com facada no coração,1
07/03/2024,10:55:00,2024,março,Só Notícias,Operação é deflagrada para investigar descarte ilegal às margens de rio em MT,1
07/03/2024,10:56:00,2024,março,Midia News,Polícia investiga lixão de para-brisas às margens do Rio Cuiabá,1
07/03/2024,13:39:00,2024,março,Só Notícias,Mãe e filho morrem em acidente na BR-163 em Lucas do Rio Verde,1
07/03/2024,16:00:00,2024,março,Reporter MT,Vídeo: Batida frontal entre Fiesta e Sw4 mata duas pessoas na BR-163,1
07/03/2024,16:28:00,2024,março,Só Notícias,Secretário confirma projeto para implantar Politec e reforço no efetivo policial em Lucas,2
07/03/2024,20:09:00,2024,março,Só Notícias,Homem e mulher são amarrados e executados em Sinop,1
07/03/2024,08h:10,2024,março,Folhamax,Jovem é sequestrado e morto com facadas no coração em MT,1
07/03/2024,08h:41,2024,março,Folhamax,"Em noite de massacre, 6 são executados a tiros em cidade de MT",1
07/03/2024,10h:45,2024,março,Gazeta Digital,Polícia deflagra operação para apurar descarte ilegal às margens do Rio Cuiabá,1
07/03/2024,11h:07,2024,março,Folhamax,PC investiga descarte de para-brisas às margens do Rio Cuiabá,1
07/03/2024,11h:30,2024,março,Gazeta Digital,Corpo de jovem é encontrado amarrado em estrada de MT,1
08/03/2024,07:00:00,2024,março,Reporter MT,"""Tenho certeza que teve responsabilidade do instrutor"", afirma pai de Lucas Peres",1
08/03/2024,07:23:00,2024,março,Estadão MT,VEJA  Casal é executado a facadas dentro de quitinete,1
08/03/2024,09:15:00,2024,março,Reporter MT,Casal tem mãos e pés amarrados e é executado dentro de casa,1
08/03/2024,10:00:00,2024,março,Reporter MT,Mauro anuncia decreto que obriga que cursos de formação de militares em MT sejam filmados,1
08/03/2024,10:40:00,2024,março,Reporter MT,"Motociclista invade canteiro central, é atropelado e morre em Cuiabá; vídeo",1
08/03/2024,11:22:00,2024,março,Reporter MT,Mulher é atingida por carro e morre em rodovia; motorista fugiu,1
08/03/2024,17:29:00,2024,março,Só Notícias,Lei seca tem 12 motoristas presos por embriaguez em Nova Mutum,1
08/03/2024,19:32:00,2024,março,Só Notícias,Polícia Civil localiza corpo de homem desaparecido em Barra do Garças,1
08/03/2024,22:09:00,2024,março,Só Notícias,Irmãos são atingidos por tiros e um morre em Sorriso,1
08/03/2024,07h:28,2024,março,Folhamax,Mulher em Biz morre após batida com carro em rodovia de MT,1
08/03/2024,09h:01,2024,março,Gazeta Digital,Motociclista morre após ser atingida por carro em rodovia,1
08/03/2024,11h:49,2024,março,Gazeta Digital,Motociclista morre após cair e ser atropelado em Cuiabá,1
08/03/2024,15h:01,2024,março,Gazeta Digital,Trio invade residência e atira contra jovem de 23 anos em VG,1
08/03/2024,17h:32,2024,março,Folhamax,Usuário de drogas é morto e desovado em gruta perto de córrego,1
08/03/2024,19h:22,2024,março,Folhamax,Piloto morre em batida com picape; motorista foge em MT,1
09/03/2024,07:23:00,2024,março,Só Notícias,Homem é morto a tiros após ser chamado na janela de casa em Sorriso,1
09/03/2024,09:55:00,2024,março,Estadão MT,Assassino chama homem na janela de casa e o mata com tiro na cabeça,1
09/03/2024,10:10:00,2024,março,Estadão MT,Homem é encontrado morto com rosto desfigurado no meio da rua,1
09/03/2024,10:12:00,2024,março,Reporter MT,Homem sai na janela de casa e é morto com tiro na cabeça,1
09/03/2024,14:21:00,2024,março,Só Notícias,Corpo é encontrado em estrada vicinal de Nova Mutum e polícia constata sinais de execução,1
09/03/2024,20:03:00,2024,março,Estadão MT,Dono de sítio é preso em flagrante por vender combustíveis ilegalmente,1
09/03/2024,09h:37,2024,março,Gazeta Digital,Homem é encontrado morto perto de bar no interior de MT,1
09/03/2024,11h:50,2024,março,Gazeta Digital,Corpo de homem desaparecido é encontrado em estado de decomposição,1
09/03/2024,17h:42,2024,março,Folhamax,PJC identifica sítio utilizado para vender combustível ilegalmente,1
10/03/2024,07:56:00,2024,março,Reporter MT,"Pai de aluno bombeiro morto diz que não quer vingança: ""Não consigo sentir nem ódio, quem fez isso vai se explicar para Deus""",1
10/03/2024,08:48:00,2024,março,Reporter MT,Idoso morre em batida entre moto e Creta em MT,1
10/03/2024,09:42:00,2024,março,Reporter MT,Motociclista bate em animal na pista e morre,1
10/03/2024,10:30:00,2024,março,Reporter MT,"Motorista de carreta fura preferencial, atropela e mata motociclista",1
10/03/2024,10:41:00,2024,março,Só Notícias,Lei seca em Sinop tem mais de 20 motoristas presos por dirigirem alcoolizados,1
10/03/2024,11:30:00,2024,março,Só Notícias,Motociclista morre ao colidir com carreta em rodovia no Nortão,1
10/03/2024,14:00:00,2024,março,Só Notícias,Dois morrem em acidentes em Mato Grosso,1
10/03/2024,14:17:00,2024,março,Reporter MT,"Motociclista tenta fazer ultrapassagem, bate de frente com caminhão e morre",1
10/03/2024,14:23:00,2024,março,Reporter MT,Homem é executado com tiro na cabeça e corpo é jogado em plantação,1
10/03/2024,19:05:00,2024,março,Só Notícias,Carreta tomba e motorista morre na Serra do São Vicente em Mato Grosso,1
10/03/2024,07h:28,2024,março,Gazeta Digital,Idoso de 62 anos morre após bater motocicleta em Creta,1
10/03/2024,08h:19,2024,março,Gazeta Digital,Motociclista de 52 anos morre após atingir animal em rodovia no interior de MT,1
10/03/2024,09h:57,2024,março,Gazeta Digital,Motociclista morre em Rondonópolis  após carreta invadir preferencial e o atingir,1
10/03/2024,12h:07,2024,março,Folhamax,Idoso de 62 anos morre após bater motocicleta em Creta,1
10/03/2024,12h:15,2024,março,Folhamax,Motociclista morre em Rondonópolis após carreta invadir preferencial,1
10/03/2024,15h:30,2024,março,Gazeta Digital,Motociclista morre após colidir com caminhão na MT-208,1
11/03/2024,09:01:00,2024,março,Reporter MT,Homem é morto a tiros durante torneio de futebol,1
11/03/2024,09:42:00,2024,março,Reporter MT,Empresário é sequestrado e encontrado morto em estrada; vídeo mostra ação de bandidos,1
11/03/2024,11:29:00,2024,março,Só Notícias,Homem morre em colisão de carro em árvore no Mato Grosso,1
11/03/2024,07h:55,2024,março,Folhamax,Homem é morto a tiros pelo primo em torneio de futebol em MT,1
11/03/2024,07h:56,2024,março,Gazeta Digital,Homem morre após tombar carreta na Serra de São Vicente,1
11/03/2024,08h:37,2024,março,Folhamax,"Após sequestro, empresário é morto e deixado na beira de estrada em MT",1
11/03/2024,09h:53,2024,março,Gazeta Digital,Homem é morto a tiros próximo a veículo durante festa no interior de Mato Grosso,1
11/03/2024,14h:35,2024,março,Folhamax,Vídeo mostra empresário de MT sendo sequestrado por encapuzados,1
11/03/2024,18h:55,2024,março,Folhamax,Entrevistados reforçam que violência começa quando o respeito acaba,1
11/03/2024,19h:58,2024,março,Folhamax,"Carro capota e motorista morre; passageira ""voa"" para fora",1
12/03/2024,08:40:00,2024,março,Só Notícias,Dono de empresa é assassinado a tiros no Nortão,1
12/03/2024,09:03:00,2024,março,Estadão MT,Confronto entre policiais e trio de criminosos termina com um preso em MT,1
12/03/2024,13:01:00,2024,março,Estadão MT,Corpo de homem é encontrado em estado decomposição em área de mata,1
12/03/2024,08h:41,2024,março,Gazeta Digital,Jovens são encontrados mortos em área de mata no interior de MT,1
