Data,Hora,Ano,Mês,Site,Manchete,Polaridade
05/03/2023,14h:57,2023,março,Folhamax,Detran orienta sobre troca de placa de identificação de veículo em caso de clonagem,1
06/03/2023,06:51:00,2023,março,Reporter MT,Batida entre S10 e Hilux mata motorista em MT,1
06/03/2023,07:38:00,2023,março,Só Notícias,Identificados 7 mortos em acidente entre ônibus e carreta em rodovia de Mato Grosso,2
06/03/2023,07:49:00,2023,março,Estadão MT,Detran orienta sobre troca de placa de identificação de veículo em caso de clonagem,1
06/03/2023,08:27:00,2023,março,Estadão MT,Adolescente mata produtor rural e foge com sua caminhonete em MT,1
06/03/2023,08:50:00,2023,março,Reporter MT,Vítimas fatais de acidente entre caminhão e ônibus são identificadas; veja nomes,2
06/03/2023,11:45:00,2023,março,Só Notícias,Localizado corpo de criança em área de mata em Colíder; ex-padrasto confessou crime,1
06/03/2023,13:38:00,2023,março,Só Notícias,Filho mata o próprio pai em assentamento em Sorriso e acaba preso pela PRF,1
06/03/2023,13:59:00,2023,março,Só Notícias,Idoso morre em acidente com trator no Nortão,1
06/03/2023,14:29:00,2023,março,Estadão MT,Mato Grosso começa a emitir nova Carteira de Identidade Nacional,2
06/03/2023,14:59:00,2023,março,Só Notícias,Mato Grosso começa a emitir nova carteira de identidade nacional; mais de 300 pedidos em 30 minutos,2
06/03/2023,17:14:00,2023,março,Estadão MT,Homens são encontrados mortos ao lado de moto e caso intriga cidade de MT,1
06/03/2023,19:31:00,2023,março,Reporter MT,Trabalhador morre esmagado por trator em MT,1
06/03/2023,08h:30,2023,março,Gazeta Digital,Estudante de agronomia morre em batida entre Hilux e S10,1
06/03/2023,08h:41,2023,março,Folhamax,Acidente com moto de alta cilindrada mata piloto e passageiro em MT,1
06/03/2023,09h:12,2023,março,Folhamax,Caminhonetes batem de frente e universitário morre em MT; veja vídeo,1
06/03/2023,11h:15,2023,março,Folhamax,Veja quem são as vítimas do acidente com 7 mortes em MT,1
06/03/2023,11h:34,2023,março,Gazeta Digital,Mendes cita segurança contra fraude e golpes com CIN,2
06/03/2023,11h:37,2023,março,Folhamax,Mauro afirma que novo documento vai prevenir fraudes em MT,2
06/03/2023,12h:13,2023,março,Folhamax,MT começa a emitir nova carteira de identidade nacional unificada,2
06/03/2023,12h:44,2023,março,Folhamax,Detran orienta sobre troca de placa de veículo,1
06/03/2023,14h:04,2023,março,Gazeta Digital,Cães farejadores encontram corpo de menino assassinado pelo ex-padrasto,1
06/03/2023,17h:24,2023,março,Gazeta Digital,Mulher morre em acidente de carro a caminho de cidade em que marido havia falecido horas antes,1
06/03/2023,17h:40,2023,março,Folhamax,"Carreta teria invadido pista contrária, diz PRF sobre acidente",1
06/03/2023,18h:02,2023,março,Folhamax,Batida entre moto e carro mata piloto em rodovia de MT; veja vídeo,1
06/03/2023,19h:03,2023,março,Folhamax,Idoso morre ao ser esmagado por trator no interior de MT,1
07/03/2023,09:31:00,2023,março,Estadão MT,Jovem é executado a tiros enquanto jantava em Cuiabá,1
07/03/2023,09:38:00,2023,março,Estadão MT,MT Saúde promove ações em órgãos públicos para reforçar importância do autocuidado,1
07/03/2023,09:44:00,2023,março,Reporter MT,Delegado: Padrasto matou menino por vingança contra mãe; assassino deixou carta,1
07/03/2023,09:47:00,2023,março,Só Notícias,Homem morre após ser atingido por patrol no Nortão,1
07/03/2023,11:07:00,2023,março,Estadão MT,Fotos: Homem morre esmagado durante obra em estrada no Nortão,1
07/03/2023,14:50:00,2023,março,Reporter MT,Mato Grosso começa a emitir nova Carteira de Identidade Nacional,1
07/03/2023,15:23:00,2023,março,Estadão MT,Homem é executados com tiros no rosto enquanto dormia,1
07/03/2023,22:01:00,2023,março,Reporter MT,Homem morre esmagado por motoniveladora ao parar em estrada em obras,1
07/03/2023,00h:05,2023,março,Folhamax,Fotógrafa morta em acidente após saber de infarto do marido estava sem cinto em MT,1
07/03/2023,07h:46,2023,março,Folhamax,Assassinos invadem quitinete e matam desafeto durante jantar em Cuiabá,1
07/03/2023,08h:16,2023,março,Gazeta Digital,Veja vídeo; motociclista morre atingido por carro na MT-060,1
07/03/2023,08h:48,2023,março,Folhamax,MT Saúde alerta servidores sobre autocuidado,1
07/03/2023,09h:55,2023,março,Folhamax,Homem com longa ficha criminal é morto na frente da namorada em MT,1
07/03/2023,17h:40,2023,março,Gazeta Digital,Deficiente é morto com mais de 20 tiros na frente da esposa no bairro Despraido,1
07/03/2023,18h:05,2023,março,Folhamax,População precisa regularizar CPF antes de solicitar CIN,2
07/03/2023,18h:37,2023,março,Gazeta Digital,Homem é assassinado com tiros na cabeça e no rosto em MT,1
08/03/2023,08:33:00,2023,março,Só Notícias,Homem morto em acidente com patrol no Nortão é transladado para Mato Grosso do Sul,1
08/03/2023,09:33:00,2023,março,Reporter MT,Homem é executado a tiros no meio da rua no dia do aniversário,1
08/03/2023,14:59:00,2023,março,Só Notícias,Operação conjunta apreende produtos veterinários em Cuiabá; multa aplicada de R$ 220 mil,1
08/03/2023,15:50:00,2023,março,Reporter MT,Batida entre caminhões mata motorista na MT-208,1
08/03/2023,07h:55,2023,março,Folhamax,Rapaz é executado a tiros no dia do aniversário; amigo sobrevive,1
08/03/2023,08h:03,2023,março,Folhamax,Corpo de homem é localizado boiando dentro de rio em MT,1
08/03/2023,09h:55,2023,março,Folhamax,Motociclista morre após ser atropelado por maquina em rodovia; vídeo,1
08/03/2023,15h:20,2023,março,Folhamax,Dono de pet shops é preso por crime ambiental e multado em R$ 220 mil,1
08/03/2023,15h:23,2023,março,Folhamax,Corregedoria inicia preparativos para Semana do Registro Civil,1
08/03/2023,15h:40,2023,março,Gazeta Digital,Caminhoneiro é achado morto a 200 metros de batida,1
09/03/2023,08:59:00,2023,março,Só Notícias,Corpo de homem é localizado com marcas de tiros em bairro de Sorriso,1
09/03/2023,09:48:00,2023,março,Só Notícias,Homem é assassinado a tiros em bar em Nova Mutum,1
09/03/2023,09:49:00,2023,março,Estadão MT,Corpo é localizado debaixo de ponte e pode ser de caminhoneiro desaparecido,1
09/03/2023,10:12:00,2023,março,Estadão MT,Homem é executado a tiros em bar de MT,1
09/03/2023,10:34:00,2023,março,Só Notícias,Corpo é localizado embaixo de ponte em Mato Grosso e polícia apura se é de caminhoneiro desaparecido,1
09/03/2023,11:35:00,2023,março,Só Notícias,Polícia confirma localização de corpo com sinais de execução em Lucas do Rio Verde,1
09/03/2023,22:00:00,2023,março,Reporter MT,Trabalhador é esmagado durante obra em residencial,1
09/03/2023,22:36:00,2023,março,Só Notícias,Prefeito de Sorriso em Portugal,1
09/03/2023,07h:29,2023,março,Folhamax,Homem é executado com tiros na cabeça e tórax dentro de bar em MT,1
09/03/2023,08h:19,2023,março,Gazeta Digital,Homem é executado com 4 tiros em bar no interior de MT,1
09/03/2023,10h:30,2023,março,Folhamax,Caminhoneiro foi morto por ladrões e teve corpo desovado em saco plástico,1
09/03/2023,15h:47,2023,março,Folhamax,Morador acha corpo de rapaz executado a tiros e desovado em mata,1
09/03/2023,17h:06,2023,março,Folhamax,Mulher é achada morta com ferimento na cabeça dentro de casa,1
09/03/2023,17h:10,2023,março,Gazeta Digital,"Inconformada, mãe cobra de autoridades apuração sobre morte de filho policial",1
09/03/2023,17h:30,2023,março,Gazeta Digital,Corpo de jovem é encontrado aos fundos de mata em Sorriso,1
10/03/2023,10:18:00,2023,março,Estadão MT,Homem é morto com quatro tiros na cabeça e corpo é desovado em Sorriso,1
10/03/2023,17:10:00,2023,março,Reporter MT,Universitária cai de moto e morre atropelada por carreta,1
10/03/2023,18:41:00,2023,março,Só Notícias,Prefeito articula com Politec instalação de unidade em Lucas do Rio Verde; R$ 5 milhões,2
10/03/2023,19:00:00,2023,março,Estadão MT,Dupla invade casa e dispara contra carro para assustar vítima,1
10/03/2023,07h:52,2023,março,Gazeta Digital,Corpo de motoboy é encontrado com mãos amarradas,1
10/03/2023,08h:16,2023,março,Gazeta Digital,Duas mulheres ficaram feridas em um acidente entre dois veículos e moto,1
10/03/2023,10h:35,2023,março,Folhamax,Motoboy é torturado e executado a tiros com mãos amarradas em MT,1
10/03/2023,14h:44,2023,março,Folhamax,Estudante de Direito perde controle de moto e morre atropelada por carreta em MT,1
10/03/2023,18h:25,2023,março,Gazeta Digital,Estudante de Direito morre atropelada após perder controle de moto em rodovia de MT,1
10/03/2023,19h:05,2023,março,Folhamax,Idoso é morto a tiros após briga motivada por bebedeira,1
11/03/2023,07:28:00,2023,março,Só Notícias,Homem é atropelado durante caminhada e morre em Sinop; motorista fugiu,1
11/03/2023,08:10:00,2023,março,Só Notícias,Homem morre atropelado na MT-208 em Alta Floresta; condutor foge,1
11/03/2023,09:44:00,2023,março,Reporter MT,"Homem mata ""amigo"" a facadas após discussão em bar",1
11/03/2023,10:33:00,2023,março,Reporter MT,Atleta é atropelado por Uno durante treino para corrida,1
11/03/2023,08h:55,2023,março,Folhamax,Atleta morre atropelado e motorista foge sem prestar socorro em MT,1
11/03/2023,08h:56,2023,março,Gazeta Digital,Homem morre após ser atropelado durante corrida; suspeito fugiu,1
11/03/2023,11h:40,2023,março,Folhamax,Motorista mata andarilho atropelado em rodovia de MT e foge,1
12/03/2023,08:09:00,2023,março,Só Notícias,Sorrisense é assassinado em bairro e perícia aponta 4 disparos de arma de fogo,2
12/03/2023,11:36:00,2023,março,Só Notícias,Homem morre no Nortão ao ser atropelado por carro na BR-163,1
12/03/2023,15:40:00,2023,março,Reporter MT,Homem morre atropelado na BR-163,1
12/03/2023,16:12:00,2023,março,Só Notícias,Três morrem em acidente entre carro e ônibus em Mato Grosso,1
12/03/2023,16:20:00,2023,março,Reporter MT,Acidente na  Estrada da Guia deixa três mortos,1
12/03/2023,10h:54,2023,março,Gazeta Digital,Homem morre após bater motocicleta contra árvore,1
12/03/2023,16h:30,2023,março,Gazeta Digital,Batida entre carro e ônibus mata 3 pessoas na Estrada da Guia; vídeo,1
12/03/2023,19h:58,2023,março,Folhamax,Motorista morre após bater em traseira de carreta em BR de MT,1
12/03/2023,20h:07,2023,março,Folhamax,Homem morre após bater motocicleta contra árvore,1
13/03/2023,07:49:00,2023,março,Reporter MT,Mortos em batida entre Palio e ônibus na Estrada da Guia são identificados,1
13/03/2023,07:49:00,2023,março,Só Notícias,Motorista de caminhão morre preso às ferragens em colisão com carreta em rodovia de Mato Grosso,1
13/03/2023,08:16:00,2023,março,Estadão MT,Jovem é morto com vários tiros na cabeça no meio da rua,1
13/03/2023,08:19:00,2023,março,Só Notícias,Motociclista morre em colisão frontal com carro em rodovia de MT; condutor fugiu,1
13/03/2023,08:27:00,2023,março,Reporter MT,Caminhoneiro morre ao bater na traseira de carreta na Serra de São Vicente,1
13/03/2023,09:05:00,2023,março,Estadão MT,Grave acidente entre carro e moto termina com morte na Imigrantes,1
13/03/2023,15:57:00,2023,março,Estadão MT,Vídeo: Motociclista bate em caminhão parado e morre em MT,1
13/03/2023,15:59:00,2023,março,Só Notícias,Localizado corpo de empresário que se afogou durante pescaria no Médio Norte,1
13/03/2023,19:33:00,2023,março,Só Notícias,Abrigo de mulheres pega fogo em Sorriso,1
13/03/2023,07h:14,2023,março,Folhamax,Rapaz morre após ser baleado com quatro tiros em MT,1
13/03/2023,07h:57,2023,março,Gazeta Digital,Homem morre em grave acidente entre veículos de carga,1
13/03/2023,07h:59,2023,março,Folhamax,Motociclista morre após ser atropelado por Parati em VG,1
13/03/2023,08h:52,2023,março,Gazeta Digital,Motociclista morre após ser atropelado por veículo de passeio na BR-070 em VG,1
13/03/2023,10h:07,2023,março,Gazeta Digital,Jovem de 21 anos é executado com tiros na cabeça durante a madrugada em Sorriso,1
13/03/2023,13h:04,2023,março,Folhamax,Três mortos em acidente entre Pálio e ônibus são identificados,1
13/03/2023,14h:22,2023,março,Gazeta Digital,Homem morre após bater em caminhão parado na MT-060 durante a madrugada,1
13/03/2023,15h:27,2023,março,Folhamax,Motociclista bate em caminhão parado em rodovia e morre na hora; veja vídeos,1
13/03/2023,16h:02,2023,março,Folhamax,Corpo de empresário é achado perto de tablado usado para pescaria,1
13/03/2023,18h:21,2023,março,Gazeta Digital,Corpo de empresário é localizado a 10 km de tablado em rio,1
14/03/2023,08:16:00,2023,março,Estadão MT,Mãe e filho são executados dentro de casa com tiros na cabeça e no pescoço em MT,1
14/03/2023,08:16:00,2023,março,Reporter MT,Mãe e filho são assassinados com tiros na cabeça e pescoço em MT,1
14/03/2023,08:47:00,2023,março,Só Notícias,Bombeiros de Nova Mutum localizam jovem afogado em rio no Médio Norte; 2ª vítima em 24 horas,1
14/03/2023,08h:13,2023,março,Gazeta Digital,Homem encapuzado invade casa e mata mãe e filho a tiros,1
14/03/2023,09h:40,2023,março,Folhamax,Mulher executada junto com filho foi ameaçada por briga de imóvel,1
14/03/2023,12h:10,2023,março,Folhamax,Dupla estaciona na frente de casa e executa rapaz com vários tiros em MT,1
14/03/2023,14h:50,2023,março,Folhamax,Bombeiros acham corpo de rapaz que sumiu em rio após surto,1
15/03/2023,10:54:00,2023,março,Reporter MT,Jovem tenta ultrapassagem e morre ao bater de frente com caminhão,1
15/03/2023,14:41:00,2023,março,Só Notícias,Quatro acusados de roubo são mortos em confronto com a Rotam em Mato Grosso,1
15/03/2023,14h:50,2023,março,Gazeta Digital,Quatro são mortos durante troca de tiros com a Polícia Militar,1
15/03/2023,18h:17,2023,março,Folhamax,Operação em fazenda flagra desmatamento e gera prisão,1
16/03/2023,10:39:00,2023,março,Só Notícias,Jovem é assassinada a facadas pelo ex-namorado em Mato Grosso,1
16/03/2023,13:59:00,2023,março,Só Notícias,Caminhão carregado de madeira tomba e motorista morre em rodovia de Mato Grosso,1
16/03/2023,17:40:00,2023,março,Estadão MT,Criança de 4 anos morre ao dar entrada em hospital por dor abdominal,1
16/03/2023,09h:55,2023,março,Gazeta Digital,Jovem de 20 anos é morta a facadas pelo ex-namorado,1
16/03/2023,10h:42,2023,março,Gazeta Digital,Homem é morto a pedradas em bar no interior de Mato Grosso,1
16/03/2023,14h:09,2023,março,Folhamax,Criança de 4 anos morre após dar entrada numa UPA em MT,1
16/03/2023,14h:32,2023,março,Folhamax,Carreta com madeira tomba em rodovia e motorista morre na hora; veja vídeo,1
16/03/2023,18h:04,2023,março,Folhamax,"Cadáver de homem é achado com a cabeça ""estourada""",1
16/03/2023,23h:10,2023,março,Folhamax,Homem é surpreendido em carro e executado com tiros na cabeça em MT,1
17/03/2023,07:38:00,2023,março,Só Notícias,Homem é assassinado a tiros ao chegar em casa em Sinop,1
17/03/2023,08:25:00,2023,março,Estadão MT,Homem é morto a pedradas em bar no Nortão,1
17/03/2023,11:29:00,2023,março,Só Notícias,Sinop: corpo de criança que morreu na UPA é exumado a pedido da polícia que investiga se houve negligência médica,1
17/03/2023,16:20:00,2023,março,Reporter MT,Corpo de criança de 3 anos é exumado para apurar possível erro médico em UPA de MT,1
17/03/2023,20:52:00,2023,março,Só Notícias,Homem é assassinado a tiros em pesqueiro em Sinop; suspeitos são presos,1
17/03/2023,14h:50,2023,março,Folhamax,Corpo de criança é exumado para exames complementares,1
17/03/2023,15h:23,2023,março,Folhamax,Programa analisa dados sobre o trânsito na Capital,1
17/03/2023,17h:10,2023,março,Gazeta Digital,Guarda é assassinado de madrugada quando voltava para casa do trabalho,1
17/03/2023,19h:15,2023,março,Folhamax,"Sob pressão, mais 2 médicos são afastados após morte de menina em UPA",1
18/03/2023,10:40:00,2023,março,Estadão MT,Mulher de 54 anos morre após cair e bater a cabeça em escada de prédio em Cuiabá,1
18/03/2023,10:43:00,2023,março,Reporter MT,"Mulher escorrega em escadaria, bate com a cabeça e morre em Cuiabá",1
18/03/2023,14:32:00,2023,março,Reporter MT,Dois executam homem a tiros em pesqueiro de MT,1
18/03/2023,08h:07,2023,março,Gazeta Digital,Jovem de 25 anos é executado a tiros em pesqueiro na MT-220,1
18/03/2023,08h:25,2023,março,Gazeta Digital,Contadora morre ao se desequilibrar e cair da escada,1
18/03/2023,09h:05,2023,março,Folhamax,"Após consumir bebida alcoólica, contadora cai da escada e morre em MT",1
18/03/2023,09h:16,2023,março,Folhamax,Jovem de 25 anos é executado a tiros em pesqueiro na MT-220,1
18/03/2023,16h:35,2023,março,Folhamax,Grávida e filho de 12 anos ficam feridos após batida de caminhonetes,1
18/03/2023,18h:55,2023,março,Folhamax,TJ mantém prisão de policiais por desviar uma tonelada de cocaína em MT,1
19/03/2023,08:31:00,2023,março,Só Notícias,Jovem é assassinado a tiros em estrada vicinal de Nova Mutum,1
19/03/2023,08:38:00,2023,março,Estadão MT,Mulher é assassinada com vários tiros neste domingo em MT,1
19/03/2023,08:56:00,2023,março,Reporter MT,"Bandidos envenenam cachorro, depois voltam e matam mulher a tiros em MT",1
19/03/2023,10:15:00,2023,março,Só Notícias,Homem é executado a tiros e tem carro incendiado no Nortão,1
19/03/2023,10:38:00,2023,março,Reporter MT,Traficante de 21 anos é atraído para emboscada e assassinado em MT,1
19/03/2023,11:23:00,2023,março,Estadão MT,Homem é morto a tiros e corpo é abandonado ao lado de carro incendiado,1
19/03/2023,15:14:00,2023,março,Reporter MT,Criminoso é morto no estacionamento do Atacadão em MT,1
19/03/2023,15:40:00,2023,março,Reporter MT,Cadáver é achado ao lado de carro incendiado em MT,1
19/03/2023,08h:34,2023,março,Gazeta Digital,Mulher de 38 anos é assassinada com tiro na cabeça dentro de casa,1
19/03/2023,09h:05,2023,março,Gazeta Digital,Corpo de homem morto a tiros é encontrado em ponto de uso e venda de drogas,1
19/03/2023,09h:58,2023,março,Gazeta Digital,Homem é executado em estrada de terra e tem veículo incendiado,1
19/03/2023,10h:56,2023,março,Folhamax,Homem é encontrado morto ao lado de carro em chamas em MT,1
19/03/2023,16h:45,2023,março,Gazeta Digital,Corpo de diarista que estava desaparecida é encontrado dentro de vala às margens do Rio dos Peixes,1
19/03/2023,17h:18,2023,março,Folhamax,Motociclista morre ao passar em ponte submersa em Cuiabá,1
19/03/2023,18h:08,2023,março,Folhamax,Homem é executado em estacionamento de mercado em MT,1
19/03/2023,19h:57,2023,março,Folhamax,"TJ mantém prisão de ""mula aérea"" de quadrilha de policiais civis de MT",1
20/03/2023,08:06:00,2023,março,Só Notícias,Mulher morre em colisão entre moto e ônibus em rodovia no Médio Norte,1
20/03/2023,13:38:00,2023,março,Só Notícias,Operação conjunta cumpre 10 mandados para investigar crimes ambientais em MT; um em Sinop,2
20/03/2023,15:16:00,2023,março,Estadão MT,Fazendas são alvos da Polícia por suspeitas de crimes ambientais no Pantanal,1
20/03/2023,07h:40,2023,março,Folhamax,Ex-presidiário é assassinado com 4 tiros em espetinho em VG,1
20/03/2023,08h:06,2023,março,Folhamax,Motociclista morre após perder controle e bater contra caminhonete em MT,1
20/03/2023,08h:20,2023,março,Folhamax,Idoso tira a própria vida dentro de casa e filha encontra corpo,1
20/03/2023,09h:10,2023,março,Folhamax,Tiroteio em bar mata homem e fere mulher em Cuiabá; veja vídeos,1
20/03/2023,09h:15,2023,março,Folhamax,Mulher morre após perder controle e bater moto de frente com ônibus em MT,1
20/03/2023,09h:19,2023,março,Gazeta Digital,Jovem de 21 anos é executado a tiros em estrada vicinal,1
20/03/2023,09h:45,2023,março,Gazeta Digital,Ex-presidiário é morto com 3 tiros por dupla em motocicleta,1
20/03/2023,10h:08,2023,março,Gazeta Digital,Mulher morre em colisão frontal entre moto e ônibus,1
20/03/2023,10h:52,2023,março,Gazeta Digital,Bolsonarista é morto a tiros após discordar de petista,1
20/03/2023,13h:44,2023,março,Folhamax,Jovem é encontrado morto em estrada de terra,1
20/03/2023,14h:46,2023,março,Folhamax,Corpo de homem é encontrado boiando em rio de MT,1
20/03/2023,14h:49,2023,março,Folhamax,Fazendeiros são alvos de operação por destruição do Pantanal em MT,1
20/03/2023,15h:04,2023,março,Folhamax,Bombeiros resgatam corpo de rio e PJC investiga homicídio,1
20/03/2023,15h:10,2023,março,Gazeta Digital,Polícia cumpre 10 mandados por crimes ambientais em propriedades do Pantanal de MT,1
20/03/2023,19h:10,2023,março,Folhamax,"Policial é suspeito de matar dirigente de futebol perto de bar, em Cuiabá",1
20/03/2023,19h:15,2023,março,Folhamax,Petista que matou bolsonarista em bar de MT não tem registro de arma,1
21/03/2023,07:37:00,2023,março,Estadão MT,Empresas são investigadas por suspeita de fabricar e vender uísque clandestino,1
21/03/2023,07:49:00,2023,março,Só Notícias,Polícia cumpre 6 mandados e investiga empresa em MT por crime tributário e falsificação de bebidas,1
21/03/2023,08:50:00,2023,março,Reporter MT,Polícia fecha cerco contra empresa que falsificava cervejas e sonegou R$ 2 milhões,1
21/03/2023,14:40:00,2023,março,Reporter MT,Vizinho vê sangue embaixo da porta e polícia encontra corpo enrolado em edredom,1
21/03/2023,19:47:00,2023,março,Reporter MT,Mulher morre em batida entre motocicleta e ônibus de frigorífico,1
21/03/2023,07h:39,2023,março,Folhamax,PC mira quadrilha por vender uísque pirata e sonegar R$ 2 mi em MT,1
21/03/2023,07h:52,2023,março,Gazeta Digital,Operação cumpre mandados contra empresa que falsificava bebida alcoólica,1
21/03/2023,09h:50,2023,março,Folhamax,Entregador de lanches cai de moto e morre em avenida de Cuiabá,1
21/03/2023,09h:58,2023,março,Folhamax,Mulher é morta e deixada sob cobertor dentro de casa em MT,1
21/03/2023,14h:20,2023,março,Folhamax,PC revela que lulista e bolsonarista morto tinham relação de amizade em MT,1
21/03/2023,14h:40,2023,março,Folhamax,Mulher é achada morta em casa com carta para cuidar de sua filha,1
21/03/2023,16h:05,2023,março,Gazeta Digital,Mulher é encontrada morta pelo irmão dentro de casa em Cuiabá; polícia investiga,1
22/03/2023,07:38:00,2023,março,Só Notícias,Corpo de homem é localizado em estrada de Sinop,1
22/03/2023,14:13:00,2023,março,Só Notícias,Prefeito firma acordo com MP iniciando em Nova Mutum rede de enfrentamento à violência doméstica,2
22/03/2023,09h:10,2023,março,Folhamax,Homem é morto e tem corpo deixado em plantação de milho em MT,1
22/03/2023,10h:21,2023,março,Gazeta Digital,Homem é encontrado morto ao lado de milharal em Sinop,1
22/03/2023,10h:58,2023,março,Gazeta Digital,Homem morre após sofrer descarga elétrica em bomba de água,1
22/03/2023,15h:10,2023,março,Folhamax,Homem morre após sofrer descarga elétrica em bomba,1
22/03/2023,18h:46,2023,março,Folhamax,Termo de cooperação para criar rede de enfrentamento é assinado,2
23/03/2023,07:38:00,2023,março,Só Notícias,Dois criminosos invadem casa e matam homem a tiros em Sinop,1
23/03/2023,08:19:00,2023,março,Só Notícias,"Motociclista perde controle, cai de barranco e morre na BR-163 no Nortão",1
23/03/2023,08:40:00,2023,março,Só Notícias,Homem é encontrado morto em carro em Sorriso e polícia encontra carta,1
23/03/2023,08:56:00,2023,março,Só Notícias,Colisão frontal entre caminhão e carro na rodovia Sinop-Cláudia deixa um morto; vítima identificada,1
23/03/2023,09:18:00,2023,março,Estadão MT,Agente funerário é executado dentro de casa em Sinop,1
23/03/2023,11:41:00,2023,março,Reporter MT,Jovem morre ao tentar ultrapassar carreta e bater em meio-fio na BR-163,1
23/03/2023,11:45:00,2023,março,Reporter MT,Motorista de aplicativo é morto a tiros em MT e assassino deixa bilhete: “Abusou da minha filha”,1
23/03/2023,14:50:00,2023,março,Estadão MT,Homem assassina motorista de aplicativo a tiros e o acusa de estuprar sua filha,1
23/03/2023,15:18:00,2023,março,Estadão MT,Vídeos: Jovem perde o controle de moto e morre ao ser arremessado em barranco,1
23/03/2023,16:45:00,2023,março,Reporter MT,"Mulheres são mortas a tiros, com mãos amarradas nas costas em MT",1
23/03/2023,20:54:00,2023,março,Só Notícias,Polícia Civil localiza ossada que pode ser de homem desaparecido há quase um ano no Médio Norte,1
23/03/2023,21:58:00,2023,março,Reporter MT,Motorista morre após colisão entre SUV e caminhão-tanque,1
23/03/2023,07h:30,2023,março,Folhamax,"Agente funerário é executado dentro de casa, na frente da avó e irmãos",1
23/03/2023,08h:15,2023,março,Gazeta Digital,Mulher é encontrada morta enrolada em lençol na própria residência,1
23/03/2023,08h:54,2023,março,Folhamax,Rapaz cai em ribanceira e morre após ultrapassagem forçada,1
23/03/2023,08h:57,2023,março,Gazeta Digital,Homem é executado com tiros na cabeça no sofá de casa,1
23/03/2023,09h:24,2023,março,Gazeta Digital,Motociclista morre ao tentar ultrapassagem e cair barranco,1
23/03/2023,10h:50,2023,março,Folhamax,"Motorista de app é morto e assassino deixa bilhete: ""será pedófilo no inferno""",1
23/03/2023,11h:04,2023,março,Folhamax,Condutor de SUV luxuoso morre ao bater de frente com caminhão em rodovia,1
23/03/2023,11h:26,2023,março,Gazeta Digital,Pai mata motorista de aplicativo suspeito de estuprar menina,1
23/03/2023,14h:18,2023,março,Folhamax,Mulheres da Sesp-MT participam de encontro nacional,1
23/03/2023,14h:30,2023,março,Folhamax,Idoso é achado esfaqueado em matagal e morre em hospital,1
23/03/2023,14h:35,2023,março,Folhamax,Homicídios aumentam mais de 360% em Sorriso,1
23/03/2023,16h:40,2023,março,Folhamax,"Bandido é baleado na ""bunda"" ao tentar atropelar PM com Corolla em Cuiabá",1
