Data,Hora,Ano,Mês,Site,Manchete,Polaridade
16/09/2005,08:30:00,2005,setembro,Só Notícias,IML de Sorriso será inaugurado hoje à tarde,2
18/01/2006,18:35:00,2006,janeiro,Só Notícias,Secretaria vai cortar ponto de policiais e escrivães em greve,0
19/01/2006,07:50:00,2006,janeiro,Só Notícias,Governo vai cortar ponto de policiais que não voltarem ao trabalho,0
09/02/2006,17:42:00,2006,fevereiro,Só Notícias,Exumação do corpo do juiz Leopoldino do Amaral confirmada para sábado,2
23/03/2006,17:47:00,2006,março,Só Notícias,Exame de DNA confirma ser de juiz Leopoldino o corpo enterrado em Poconé,2
08/09/2006,15:03:00,2006,setembro,Só Notícias,"Após perícia, presidente de associação em Sinop processará aposentada",2
15/09/2006,08:17:00,2006,setembro,Só Notícias,Polícia de Sinop e Colíder recebem viaturas na próxima semana,1
01/10/2006,08:39:00,2006,outubro,Só Notícias,Jato Legacy continua na Serra do Caximbo para perícia,0
20/10/2006,17:29:00,2006,outubro,Só Notícias,Corpo de homem que morreu no início da semana foi localizado hoje em Sinop,2
03/01/2007,09:34:00,2007,janeiro,Só Notícias,Lucas R. Verde implanta projeto de proteção a fauna e meio ambiente,1
23/01/2007,08:11:00,2007,janeiro,Só Notícias,Moto é furtada de pátio do instituto de criminalística de Sinop,0
08/02/2007,11:27:00,2007,fevereiro,Só Notícias,Empresários do setor de vestuário de MT vão a Europa participar de feira,1
08/02/2007,16:10:00,2007,fevereiro,Só Notícias,Polícia Civil deflagra operações contra tráfico de drogras em Mato Grosso,1
15/02/2007,08:11:00,2007,fevereiro,Só Notícias,Segurança tem orçamento de R$ 501 milhões para ano passado,1
19/03/2007,16:02:00,2007,março,Só Notícias,"Homicídios no Estado caíram 20% nos últimos 4 anos, aponta USP",2
05/04/2007,07:13:00,2007,abril,Só Notícias,Nova Mutum poderá ter unidade da Politec para “desafogar” Sinop,2
04/06/2007,17:10:00,2007,junho,Só Notícias,Sejusp e Sema assinam cooperação para o combate aos crimes ambientais,2
21/06/2007,10:04:00,2007,junho,Só Notícias,Sejusp diz que novo sistema reduz gastos de combustível com viaturas,2
22/06/2007,10:36:00,2007,junho,Só Notícias,Perícia de Sinop não descarta incêndio criminoso em madeireira,2
05/07/2007,16:14:00,2007,julho,Só Notícias,"Integração entre Sema e polícia fortalece combate aos crimes ambientais, diz secretário",2
06/07/2007,09:02:00,2007,julho,Só Notícias,Dois peritos criminais mato-grossense vão integrar a Força de Segurança no PAN,2
23/07/2007,17:11:00,2007,julho,Só Notícias,Inscrições de teste para contratação de agentes prisionais começam amanhã,1
27/07/2007,07:55:00,2007,julho,Só Notícias,Carro de Sinop pode ter placas dubladas em Salvador,2
05/08/2007,09:25:00,2007,agosto,Só Notícias,"Em meio a crise aérea, Gaudenzi assume comando da Infraero",1
03/10/2007,18:05:00,2007,outubro,Só Notícias,"Mato Grosso recebe R$ 4,5 milhões para segurança",1
06/10/2007,07:42:00,2007,outubro,Só Notícias,Polícia de Sinop receberá novas viaturas,1
11/10/2007,14:36:00,2007,outubro,Só Notícias,Viaturas policiais locadas para cidades pólos serão entregues esta tarde,1
17/10/2007,17:10:00,2007,outubro,Só Notícias,Mato Grosso terá laboratório de DNA,2
24/10/2007,09:43:00,2007,outubro,Só Notícias,Envio de 12 viaturas para Sinop deve atrasar,0
29/10/2007,13:51:00,2007,outubro,Só Notícias,Tangará da Serra discute medidas de segurança pública,2
10/11/2007,08:25:00,2007,novembro,Só Notícias,Sinop: recuperação da pista do aeroporto fica pronta em 30 dias,1
15/12/2007,08:09:00,2007,dezembro,Só Notícias,Soldado e tenente são indiciados por simulação desastrosa em Rondonópolis,1
17/12/2007,11:22:00,2007,dezembro,Só Notícias,Falta de médicos legistas no Nortão sobrecarrega IML Sinop,0
18/12/2007,17:24:00,2007,dezembro,Só Notícias,Unemat fortalece parcerias com universidade de Madri,1
05/01/2008,08:04:00,2008,janeiro,Só Notícias,Sistema permitirá identificação de criminosos por digitais em Mato Grosso,2
11/01/2008,10:01:00,2008,janeiro,Só Notícias,Rondonópolis: surgem novas provas da morte de servidores da UFMT,1
15/01/2008,08:15:00,2008,janeiro,Só Notícias,Rondonópolis: soldado é denunciado por homicídio doloso em simulação,1
20/01/2008,17:13:00,2008,janeiro,Só Notícias,Presa em MT quadrilha com conexão nos morros do Rio,1
25/01/2008,07:32:00,2008,janeiro,Só Notícias,Mato Grosso terá ‘disque denúncia’ para combater criminalidade,2
22/02/2008,10:18:00,2008,fevereiro,Só Notícias,Politec contratará 64 novos peritos e médicos legistas,2
03/03/2008,13:40:00,2008,março,Só Notícias,Autorizada construção de IML em Alta Floresta,2
10/03/2008,19:40:00,2008,março,Só Notícias,Novo secretário assume e quer agregar trabalho da PF às ações do Estado,2
11/03/2008,17:31:00,2008,março,Só Notícias,Familiares não reconhecem corpo de 2ª vítima de naufrágio em MT,0
12/03/2008,13:26:00,2008,março,Só Notícias,Encontrado corpo de 6ª vítima de tragédia com chalana em MT,2
15/03/2008,07:56:00,2008,março,Só Notícias,Confirmada construção de IML em Lucas R. Verde,2
18/03/2008,10:17:00,2008,março,Só Notícias,Vereadora cobra permanência do IML em Sorriso,0
08/04/2008,17:26:00,2008,abril,Só Notícias,Sinop: empresário é preso acusado de furto de energia e agiotagem,1
09/05/2008,21:26:00,2008,maio,Só Notícias,Empresário é assassinado a tiros em Cuiabá,1
28/05/2008,13:13:00,2008,maio,Só Notícias,Definidas ações de combate a crimes ambientais em Mato Grosso,2
17/07/2008,10:01:00,2008,julho,Só Notícias,Peritos que identificaram vítimas de acidente áereo no Nortão serão homenageados,2
31/07/2008,10:11:00,2008,julho,Só Notícias,Sinop: laudo da morte de pedreiro espancado por PM não foi concluído,0
01/08/2008,07:10:00,2008,agosto,Só Notícias,"Lucas R.Verde: quadrilha especializada levou R$ 40 mil de banco, diz delegado",1
06/08/2008,10:40:00,2008,agosto,Só Notícias,Nortão: laudo da sabotagem em torres de energia deve sair na próxima semana,2
22/08/2008,10:42:00,2008,agosto,Só Notícias,Lucas R.Verde: perícia deve concluir em setembro laudo sobre furto de R$40 mil em banco,2
25/08/2008,14:03:00,2008,agosto,Só Notícias,Lucas: laudo sobre tentativa de sabotagem em torres do linhão sai em setembro,2
27/08/2008,07:15:00,2008,agosto,Só Notícias,Obras da Politec em Alta Floresta sem previsão de sair do papel,0
04/09/2008,17:07:00,2008,setembro,Só Notícias,Autoridades em MT abordam uso da inteligência para combate ao crime organizado,2
08/09/2008,08:32:00,2008,setembro,Só Notícias,Polícia Civil de MT trabalha com apenas 30% de sua capacidade,0
08/09/2008,09:27:00,2008,setembro,Só Notícias,Concluído laudo sobre furto de R$40 mil em banco de Lucas R.Verde,2
08/09/2008,11:05:00,2008,setembro,Só Notícias,Lucas R.Verde: perícia começa apurar causa de acidente com 2 mortos,2
17/09/2008,11:18:00,2008,setembro,Só Notícias,Nortão: delegado diz que advogado foi executado,1
18/09/2008,07:06:00,2008,setembro,Só Notícias,Moradores de Nova Ubiratã protestam hoje contra assassinato de advogado,1
18/09/2008,08:29:00,2008,setembro,Só Notícias,Nortão: laudo deve apontar que advogado foi asfixiado,2
19/09/2008,15:50:00,2008,setembro,Só Notícias,Causas de incêndio em prédio de INSS em Cuiabá serão apuradas,2
25/09/2008,14:22:00,2008,setembro,Só Notícias,Polícia Civil descobre depósito com peças e veículos suspeitos de roubo em Mato Grosso,1
27/09/2008,09:49:00,2008,setembro,Só Notícias,Registro deve substituir carteira de identidade em Mato Grosso,1
28/09/2008,11:15:00,2008,setembro,Só Notícias,Mais de 45 mil documentos de identidade emitidos em MT até junho,2
30/09/2008,08:50:00,2008,setembro,Só Notícias,Lucas R.Verde: polícia encerra investigação sobre furto de R$ 40 mil em banco,1
02/10/2008,14:15:00,2008,outubro,Só Notícias,Nortão: prefeitura ainda não fechou balanço do prejuízo com incêndio,1
08/10/2008,10:46:00,2008,outubro,Só Notícias,Perícia descarta colisão em acidente que deixou um morto em Sinop,2
22/10/2008,09:45:00,2008,outubro,Só Notícias,Nortão: candidato preso acusado de extorsão será recambiado,1
23/10/2008,10:11:00,2008,outubro,Só Notícias,Colíder: corpo de mulher é encontrado em matagal,1
23/10/2008,14:19:00,2008,outubro,Só Notícias,Polícia identifica mulher encontrada morta em Colíder,2
03/11/2008,16:30:00,2008,novembro,Só Notícias,Sorriso: polícia sem pistas de autores de duplo assassinato em chácara,1
04/11/2008,09:05:00,2008,novembro,Só Notícias,Laudo apontará circunstâncias de duplo homicídio em Sorriso,2
05/11/2008,07:06:00,2008,novembro,Só Notícias,Alta Floresta: polícia espera exame para saber se homem executado era boliviano,0
07/11/2008,00:08:00,2008,novembro,Só Notícias,Sorriso: polícia recebe laudo de duplo homicídio,2
19/11/2008,13:18:00,2008,novembro,Só Notícias,Policiais e técnicos em Mato Grosso são qualificados para combaterem lavagem dinheiro,2
28/11/2008,07:22:00,2008,novembro,Só Notícias,Nortão: MP espera perícia para denunciar candidato por extorsão a prefeito,2
03/12/2008,16:12:00,2008,dezembro,Só Notícias,Alta Floresta: sede da Politec será construída em 2009,2
05/12/2008,17:10:00,2008,dezembro,Só Notícias,Cerca de mil CD’s e DVD’s piratas apreendidos em Mato Grosso durante operação,1
09/12/2008,08:15:00,2008,dezembro,Só Notícias,Delegacia municipal de Sinop terá ‘nova sede’ ainda este mês,1
21/12/2008,09:00:00,2008,dezembro,Só Notícias,Carros adulterados são apreendidos em Mato Grosso,1
25/12/2008,08:43:00,2008,dezembro,Só Notícias,Laudo aponta que índios levaram 3 armas de delegacia invadida em Mato Grosso,2
22/01/2009,09:15:00,2009,janeiro,Só Notícias,Lucas R.Verde: polícia aguarda laudos da execução de homem,0
28/01/2009,15:22:00,2009,janeiro,Só Notícias,Nortão: caminhonete bate em poste e descarga elétrica mata 2,1
28/01/2009,17:04:00,2009,janeiro,Só Notícias,Bombeiros controlam incêndio em agência bancária em Cuiabá,1
04/02/2009,09:23:00,2009,fevereiro,Só Notícias,Casal preso com drogas em Alta Floresta é indiciado por tráfico,1
04/02/2009,18:02:00,2009,fevereiro,Só Notícias,Dono de empresa é preso em Sinop acusado de furto de energia,1
09/02/2009,16:47:00,2009,fevereiro,Só Notícias,Apreendido carro ‘dublê’ em Mato Grosso: 2 são presos,1
11/02/2009,17:14:00,2009,fevereiro,Só Notícias,Rondonópolis: polícia suspeitava de túnel em presídio mas acabou encontrando drogas,1
17/02/2009,08:54:00,2009,fevereiro,Só Notícias,Jovem morre esmagado por tora em Sinop,1
18/02/2009,09:19:00,2009,fevereiro,Só Notícias,Polícia instaura inquérito para apurar morte de jovem em Sinop,1
15/03/2009,00:06:00,2009,março,Só Notícias,Sinop: policial é encontrado morto em casa,1
19/03/2009,07:56:00,2009,março,Só Notícias,Peritos se reúnem com Riva e pedem apoio para concurso público,0
26/03/2009,07:11:00,2009,março,Só Notícias,"Alta Floresta: R$ 345,2 mil serão investidos na construção de Politec",2
03/04/2009,00:01:00,2009,abril,Só Notícias,Alta Floresta: lideranças cobrarão de Diogenes reforço na segurança,0
08/04/2009,13:21:00,2009,abril,Só Notícias,Alta Floresta: vereadores cobram reforço no efetivo policial e viaturas,0
22/04/2009,14:01:00,2009,abril,Só Notícias,ABIN treina policiais e servidores em Mato Grosso,2
18/05/2009,13:50:00,2009,maio,Só Notícias,Sema começa definir estratégias para combater queimadas no Estado,1
20/05/2009,09:20:00,2009,maio,Só Notícias,Três fetos são encontrados enterrados em Alta Floresta,1
29/05/2009,15:44:00,2009,maio,Só Notícias,Corpo de universitária será exumado amanhã em Mato Grosso,2
02/06/2009,07:04:00,2009,junho,Só Notícias,Começa construção da Politec em Alta Floresta,2
11/06/2009,15:30:00,2009,junho,Só Notícias,Rondonópolis: preso jovem acusado de assassinato,1
12/06/2009,08:07:00,2009,junho,Só Notícias,Vingança pode ter motivado assassinato em Rondonópolis,1
15/06/2009,15:17:00,2009,junho,Só Notícias,Vereadores prestigiam entrega de viatura a Polícia Civil de Sorriso,2
16/06/2009,09:37:00,2009,junho,Só Notícias,Sinop: prefeito quer construir base comunitária de segurança,1
30/06/2009,17:43:00,2009,junho,Só Notícias,Técnicos da Sejusp garantem vinda da Politec para Sorriso,2
01/07/2009,09:52:00,2009,julho,Só Notícias,Câmara de Alta Floresta faz última sessão antes do recesso,1
29/07/2009,08:14:00,2009,julho,Só Notícias,MT: local onde 5 ladrões de banco morreram será periciado hoje,2
09/10/2009,11:19:00,2009,outubro,Só Notícias,Sejusp fará seletivo na Politec e destina vagas para Sorriso e Rondonópolis,2
13/10/2009,11:24:00,2009,outubro,Só Notícias,Começam hoje inscrições para o processo seletivo da Politec,2
27/01/2010,16:31:00,2010,janeiro,Só Notícias,Mato Grosso tem 200 mil vagas para cursos à distância da Politec,2
03/03/2010,14:40:00,2010,março,Só Notícias,Sinop: IML e Politec ficam sem 12 profissionais devido a término de contratos,0
04/03/2010,09:29:00,2010,março,Só Notícias,Prefeitura confirma área para Politec em Sorriso e conclui projeto,2
08/03/2010,10:41:00,2010,março,Só Notícias,Aprovados no processo seletivo da Politec tem até 4ª para se apresentarem,2
09/03/2010,22:31:00,2010,março,Só Notícias,Nortão: perícia analisa atentado e GAECO protege promotora,2
12/03/2010,15:05:00,2010,março,Só Notícias,Peritos de Sinop vão a Colíder colher provas de homicídio,2
26/03/2010,16:28:00,2010,março,Só Notícias,Sinop: aprovados em processo seletivo da Politec assumem cargo,2
29/03/2010,07:07:00,2010,março,Só Notícias,Lucas: concluído laudo da perícia sobre atentado na casa de promotora,2
19/05/2010,08:09:00,2010,maio,Só Notícias,Politec começa periciar nos municípios caminhões superfaturados,2
19/05/2010,17:23:00,2010,maio,Só Notícias,Perícia em caminhões superfaturados começa pela região Noroeste,2
19/05/2010,18:59:00,2010,maio,Só Notícias,Procurador entrega no TRF recurso sobre perícia em caminhões,2
29/05/2010,07:47:00,2010,maio,Só Notícias,Sema: projetos com suspeitas de fraudes serão periciados,2
28/06/2010,07:16:00,2010,junho,Só Notícias,Sorriso: perícia ajuda polícia tentar achar criança desaparecida,2
07/07/2010,13:49:00,2010,julho,Só Notícias,Sorriso: vereador critica demora na instalação da Caixa e Politec,0
16/07/2010,07:06:00,2010,julho,Só Notícias,Sorriso: perícia sobre caso do sumiço de criança ainda não está pronta,0
20/07/2010,13:07:00,2010,julho,Só Notícias,"Perícia em maquinários superfaturados não parou, diz polícia",2
06/08/2010,11:11:00,2010,agosto,Só Notícias,Alta Floresta: sede da Politec será inaugurada em setembro,2
13/08/2010,11:00:00,2010,agosto,Só Notícias,Polícia e perícia investigam incêndio em 15 madeireiras e 100 casas,2
20/08/2010,16:30:00,2010,agosto,Reporter MT,Peritos de MT fazem curso de CSI nos EUA,2
27/08/2010,07:18:00,2010,agosto,Só Notícias,Marcelândia: conclusão de inquérito sobre grande incêndio depende de laudo,0
08/11/2010,18:31:00,2010,novembro,Só Notícias,Procurador questiona juiz sobre perícia em maquinários superfaturados,0
16/11/2010,16:33:00,2010,novembro,Midia News,Governo recorre contra perícia determinada pelo juiz Julier,0
14/02/2011,20:23:00,2011,fevereiro,Só Notícias,Deputado cobra construção de sede para Politec em Sorriso,0
22/02/2011,10:08:00,2011,fevereiro,Reporter MT,Atestados emitidos por Ubiratan Barbalho serão periciados,2
22/02/2011,18:42:00,2011,fevereiro,Só Notícias,Bomba desarmada em frente de creche em MT vai para perícia,2
15/03/2011,14:35:00,2011,março,Midia News,Noventa e nove peritos e técnicos são nomeados para a Politec,2
23/03/2011,19:43:00,2011,março,Só Notícias,Politec implanta sistema inédito de laudos com assinatura digital,2
15/04/2011,13:32:00,2011,abril,Só Notícias,Sorriso: área para construir a Politec será votada 2ª,2
19/04/2011,11:29:00,2011,abril,Só Notícias,Sorriso: câmara aprova doação de área para construir a Politec,2
29/04/2011,15:12:00,2011,abril,Midia News,Politec recebe 20 maletas importadas dos EUA,2
22/06/2011,11:58:00,2011,junho,Só Notícias,Cuiabá: perícia atesta que agente prisional morreu devido golpe de chucho,2
22/06/2011,19:57:00,2011,junho,Reporter MT,"IML confirma tiro mas diz que agente morreu por golpes de ""chuço""",2
24/06/2011,14:40:00,2011,junho,Reporter MT,Oito pedem demissão depois de motim e morte de agente,0
30/06/2011,11h:12,2011,junho,Gazeta Digital,AL aprova reajustes para servidores da Politec e Intermat,2
08/08/2011,07:02:00,2011,agosto,Só Notícias,Politec de Sorriso deve ficar pronta até final do ano,2
16/08/2011,14:20:00,2011,agosto,Só Notícias,Marcelândia: 1 ano depois laudo do incêndio em madeireiras e casas não está pronto,0
16/08/2011,12h:42,2011,agosto,Gazeta Digital,Pátio da Politec também pega fogo e queima vários carros,0
27/09/2011,17:50:00,2011,setembro,Só Notícias,Lançada obra da Politec em Sorriso,2
28/09/2011,12h:57,2011,setembro,Gazeta Digital,Politec de Sorriso começa a ser construída,2
09/10/2011,19:45:00,2011,outubro,Midia News,Politec usa funerárias para transportar corpos,0
22/12/2011,14:25:00,2011,dezembro,Só Notícias,Cuiabá: novo complexo da Politec será construído em 2012,2
22/12/2011,16:55:00,2011,dezembro,Midia News,Novo Complexo da Politec será edificado em Cuiabá,2
22/12/2011,15h:15,2011,dezembro,Gazeta Digital,Novo Complexo da Politec será construído em Cuiabá,2
12/01/2012,07:22:00,2012,janeiro,Só Notícias,Alta Floresta: laudo confirma alta velocidade em viatura que atropelou jovem,2
01/02/2012,15:34:00,2012,fevereiro,Reporter MT,Perícia começa hoje sem previsão para ser concluída; perda é total,0
01/02/2012,15:34:00,2012,fevereiro,Reporter MT,Perícia começa hoje sem previsão para ser concluída; perda é total,0
02/02/2012,07:28:00,2012,fevereiro,Reporter MT,Falta de peritos da Politec faz inquérito se arrastar,0
06/03/2012,20:52:00,2012,março,Só Notícias,Laudo médico aponta que mãe que abandonou bebê não sabia o que fazia,2
06/03/2012,18h:19,2012,março,Gazeta Digital,"Mãe que abandonou bebê não sabia o que fazia, diz laudo médico",2
14/03/2012,14:21:00,2012,março,Só Notícias,IML entrega amanhã rebecões para Sinop e Alta Floresta,2
16/03/2012,07:09:00,2012,março,Só Notícias,Sede da Politec de Sorriso deve ser concluída até maio,2
27/03/2012,08h:58,2012,março,Gazeta Digital,Agente da Politec e Federal alegam que atiraram em legítima defesa,0
28/03/2012,17:36:00,2012,março,Midia News,Técnico da Politec será afastado durante investigações,0
25/04/2012,11:58:00,2012,abril,Só Notícias,Identificados 3 mortos em acidente; corpos estão no IML Sinop,2
28/04/2012,14:03:00,2012,abril,Midia News,PM e Politec propõe nivelamento técnico,2
04/05/2012,11:25:00,2012,maio,Midia News,Família acusa Politec de descaso na perícia em cadáver,0
08/05/2012,11h:45,2012,maio,Gazeta Digital,Politec realiza seminário nacional de DNA  em Cuiabá,2
23/05/2012,15:23:00,2012,maio,Só Notícias,Politec de Sorriso será inaugurada amanhã,2
23/05/2012,16:09:00,2012,maio,Só Notícias,Politec de Sorriso obras concluídas 2012 (SN/Ivan),2
23/05/2012,16:09:00,2012,maio,Só Notícias,Politec de Sorriso obras concluídas 2012 (SN/Ivan),2
25/05/2012,16h:47,2012,maio,Gazeta Digital,Politec ganha nova sede no município de Sorriso,2
05/06/2012,16h:14,2012,junho,Gazeta Digital,"Mãe é indiciada por morte de bebê, delegada aguarda DNA",0
21/06/2012,09:50:00,2012,junho,Só Notícias,Carlos Ferraciolli assume gerência da Politec em Sinop,2
25/06/2012,07:07:00,2012,junho,Só Notícias,"Sinop: instalação de delegacias especializadas está atrasada, avalia delegado",0
26/06/2012,07:09:00,2012,junho,Só Notícias,Peritos de Sinop concluirão laudo de reconstituição do acidente com morte,2
27/07/2012,07:27:00,2012,julho,Só Notícias,Alta Floresta: concluído laudo de reconstituição de acidente que matou jovem,2
11/08/2012,09:06:00,2012,agosto,Só Notícias,Motorista embriagado atropela perita da Politec em Cuiabá,1
11/08/2012,09:27:00,2012,agosto,Reporter MT,Motorista bêbado atropela perita que atendia ocorrência de trânsito,1
11/08/2012,08h:27,2012,agosto,Gazeta Digital,Motorista bêbado atropela perita da Politec em Cuiabá,1
28/08/2012,07:04:00,2012,agosto,Só Notícias,IML de Sinop começa receber nova câmara fria,2
28/08/2012,08:27:00,2012,agosto,Reporter MT,"Após 3 meses, não há laudos, provas, nem indiciados pelo crime",0
04/09/2012,07:36:00,2012,setembro,Reporter MT,"Politec não termina laudo e inquérito sobre ""acidente"" se arrasta",0
05/09/2012,12:09:00,2012,setembro,Reporter MT,"Advogada passou reto e não pisou nos freios, aponta laudo",2
22/10/2012,07:03:00,2012,outubro,Reporter MT,"Sem peritos e laudos, inquérito sobre incêndio se arrasta há 1 ano",0
24/10/2012,08:55:00,2012,outubro,Reporter MT,Politec treina mesários para identificação de documentos falsos,2
11/11/2012,10:17:00,2012,novembro,Reporter MT,"Viatura da Politec, fora de serviço, abusa de sirene na Getúlio em pleno sábado à noite",0
12/11/2012,14:38:00,2012,novembro,Só Notícias,Nortão: perícia diz que mulher carbonizada em acidente será identificada através de DNA,2
08/12/2012,07:28:00,2012,dezembro,Só Notícias,Nortão: perícia deve concluir causas da queda de caminhão no rio em 30 dias,2
29/12/2012,07:21:00,2012,dezembro,Só Notícias,Convênio assegura R$ 599 mil para reaparelhar Politec em MT,2
07/02/2013,10:24:00,2013,fevereiro,Só Notícias,Sorriso: vereadores cobram abertura da Politec inaugurada no ano passado,0
25/02/2013,10h:39,2013,fevereiro,Gazeta Digital,Caramuru deixa comando do IML de Cuiabá,0
06/04/2013,17:19:00,2013,abril,Só Notícias,Laudo deve esclarecer morte de criança em canavial em Tangará,2
06/04/2013,14h:04,2013,abril,Gazeta Digital,Delegada aguarda laudo para encontrar estuprador de criança achada morta em canavial,0
11/04/2013,14:58:00,2013,abril,Só Notícias,Politec não confirma 3ª morte em acidente em Mato Grosso,0
13/05/2013,15h:02,2013,maio,Gazeta Digital,Politec nega atos de vandalismo e confirma atentados,0
16/05/2013,13:31:00,2013,maio,Só Notícias,Vereadores cobram equipamentos para Politec de Sorriso,0
05/06/2013,18:41:00,2013,junho,Só Notícias,Politec começa a emitir apenas laudos online,2
05/06/2013,17h:30,2013,junho,Gazeta Digital,Politec passa a emitir laudos só pela internet,2
06/06/2013,08:18:00,2013,junho,Midia News,Perícia Técnica começa a emitir apenas laudos online,2
16/07/2013,11:30:00,2013,julho,Midia News,Unidades da Politec na fronteira recebem novos rabecões,2
16/07/2013,15h:03,2013,julho,Gazeta Digital,Unidades da Politec na fronteira recebem novos rabecões,2
19/07/2013,14h:27,2013,julho,Gazeta Digital,TJMT determina perícia sob suspeita de venda de sentença,2
27/08/2013,10:12:00,2013,agosto,Só Notícias,"Definidas 190 vagas no concurso da Politec em MT; salário é R$ 7,6 mil",2
02/09/2013,20:30:00,2013,setembro,Só Notícias,"Politec em MT oferece 190 vagas com salário inicial de R$ 7,6 mil",2
02/09/2013,07h:50,2013,setembro,Gazeta Digital,Inscrições para concurso da Politec começam hoje,2
10/09/2013,15:36:00,2013,setembro,Só Notícias,Politec recebe equipamentos para criminalística e medicina legal,2
14/09/2013,11h:08,2013,setembro,Gazeta Digital,Presidente do TJ solicita perícia em prédio incendiado em Cuiabá,2
27/09/2013,07:13:00,2013,setembro,Só Notícias,Terminam domingo inscrições para 190 vagas da Politec; 8 para Sinop,2
30/09/2013,12:54:00,2013,setembro,Só Notícias,Irmãos mortos a tiros em Terra Nova do Norte (politec),1
30/09/2013,12:54:00,2013,setembro,Só Notícias,Irmãos mortos a tiros em Terra Nova do Norte (politec),1
17/10/2013,16:40:00,2013,outubro,Só Notícias,Concurso público com vagas para Politec será domingo em Cuiabá,2
17/10/2013,20:56:00,2013,outubro,Midia News,Concurso da Politec acontecerá domingo em Cuiabá,2
18/10/2013,08:09:00,2013,outubro,Midia News,Concurso da Politec acontece domingo em Cuiabá,2
22/10/2013,10:55:00,2013,outubro,Só Notícias,Politec quer mais prazo para concluir laudo do incêndio em Tribunal Justiça,0
22/10/2013,15h:37,2013,outubro,Gazeta Digital,Politec pede mais 30 dias para concluir laudo do incêndio em gráfica do TJ,0
23/10/2013,06:40:00,2013,outubro,Reporter MT,Perícia pede mais 30 dias para apurar causas do incêndio do TJ,0
04/11/2013,15:15:00,2013,novembro,Midia News,Servidores da Politec participam de 3ª etapa do Programa,2
26/11/2013,18h:47,2013,novembro,Gazeta Digital,Perícia Oficial elabora plano de ações para desastres e catástrofes,2
29/11/2013,18:12:00,2013,novembro,Só Notícias,Peritos criminais de MT paralisam as atividades na próxima semana,0
02/12/2013,10:00:00,2013,dezembro,Reporter MT,Peritos criminais de MT param por um dia para cobrar pagamento de adicional,0
02/12/2013,13h:56,2013,dezembro,Gazeta Digital,Laudo aponta que incêndio foi intencional,2
03/12/2013,07:36:00,2013,dezembro,Só Notícias,Cuiabá: laudo aponta que incêndio na Arena Pantanal foi criminoso,2
03/12/2013,14:45:00,2013,dezembro,Reporter MT,Laudo da Politec diz que incêndio no estádio da Copa foi criminoso,2
04/12/2013,09:52:00,2013,dezembro,Só Notícias,Peritos criminais paralisam atividades; profissionais de Sinop aderem,0
04/12/2013,09h:07,2013,dezembro,Gazeta Digital,Peritos criminais paralisam as atividades nesta quarta-feira,0
05/12/2013,11:07:00,2013,dezembro,Só Notícias,Peritos criminais devem decidir hoje se iniciam greve em MT,0
